{
  "adm": "0.1",
  "id": "0192b6d4-7c1e-7a3f-9e21-4b8d0c5a1f77",
  "type": "note",
  "title": "Ponuka na servis kotla",
  "created": "2026-10-22T17:28:00Z",
  "updated": "2026-10-22T17:41:12Z",
  "notebook": "0192b6d0-1a2b-7c3d-8e4f-5a6b7c8d9e0f",
  "tags": ["domacnost", "ponuky"],
  "provenance": {
    "kind": "email",
    "source": "servis@example.sk",
    "captured": "2026-10-22T17:28:00Z"
  },
  "content": [
    { "bid": "k7Qp2x", "t": "heading", "level": 2, "text": [{ "s": "Cena" }] },
    {
      "bid": "m3Zr8a",
      "t": "paragraph",
      "text": [
        { "s": "Celkom " },
        { "s": "184 EUR", "marks": ["bold"] },
        { "s": " s DPH, " },
        { "s": "podrobnosti", "marks": [{ "link": "https://example.sk/ponuka" }] },
        { "s": "." }
      ]
    },
    { "bid": "p9Lw4c", "t": "task_ref", "task": "0192b6d5-0f3e-7b11-a2c4-9d8e7f6a5b4c" },
    {
      "bid": "r2Hs6v",
      "t": "attachment",
      "blob": "blake3:9f86d081884c7d659a2feaa0c55ad015a3bf4f1b2b0b822cd15d6c15b0f00a08",
      "name": "ponuka.pdf",
      "mime": "application/pdf",
      "size": 482113
    }
  ]
}
